{
  "$schema": "https://json-schema.org/draft/2020-12/schema",
  "$id": "https://github.com/dfcaballero-la/mi-album/albums/album.schema.json",
  "title": "AlbumDefinition",
  "type": "object",
  "required": ["id", "name", "year", "packSize", "version", "totalStickers", "sections"],
  "additionalProperties": false,
  "properties": {
    "id": { "type": "string", "pattern": "^[a-z0-9]+(-[a-z0-9]+)*$" },
    "name": { "type": "string", "minLength": 1 },
    "publisher": { "type": "string" },
    "year": { "type": "integer", "minimum": 1950, "maximum": 2100 },
    "packSize": { "type": "integer", "minimum": 1, "maximum": 50 },
    "version": { "type": "string", "pattern": "^\\d+\\.\\d+\\.\\d+$" },
    "totalStickers": { "type": "integer", "minimum": 1 },
    "sections": {
      "type": "array",
      "minItems": 1,
      "items": {
        "type": "object",
        "required": ["id", "name", "stickers"],
        "additionalProperties": false,
        "properties": {
          "id": { "type": "string", "pattern": "^[a-z0-9]+(-[a-z0-9]+)*$" },
          "name": { "type": "string", "minLength": 1 },
          "group": { "type": "string" },
          "stickers": {
            "type": "array",
            "minItems": 1,
            "items": {
              "type": "object",
              "required": ["code", "index"],
              "additionalProperties": false,
              "properties": {
                "code": { "type": "string", "minLength": 1 },
                "index": { "type": "integer", "minimum": 0 },
                "name": { "type": "string" },
                "special": { "type": "boolean" }
              }
            }
          }
        }
      }
    }
  }
}
