{
  "id": "mundial-2026",
  "name": "USA México Canadá 26",
  "year": 2026,
  "packSize": 5,
  "version": "1.1.0",
  "totalStickers": 994,
  "sections": [
    {
      "id": "fwc",
      "name": "FIFA World Cup 26",
      "stickers": [
        {
          "code": "FWC-00",
          "index": 0,
          "special": true
        },
        {
          "code": "FWC-1",
          "index": 1
        },
        {
          "code": "FWC-2",
          "index": 2
        },
        {
          "code": "FWC-3",
          "index": 3
        },
        {
          "code": "FWC-4",
          "index": 4
        },
        {
          "code": "FWC-5",
          "index": 5
        },
        {
          "code": "FWC-6",
          "index": 6
        },
        {
          "code": "FWC-7",
          "index": 7
        },
        {
          "code": "FWC-8",
          "index": 8
        },
        {
          "code": "FWC-9",
          "index": 9
        },
        {
          "code": "FWC-10",
          "index": 10
        },
        {
          "code": "FWC-11",
          "index": 11
        },
        {
          "code": "FWC-12",
          "index": 12
        },
        {
          "code": "FWC-13",
          "index": 13
        },
        {
          "code": "FWC-14",
          "index": 14
        },
        {
          "code": "FWC-15",
          "index": 15
        },
        {
          "code": "FWC-16",
          "index": 16
        },
        {
          "code": "FWC-17",
          "index": 17
        },
        {
          "code": "FWC-18",
          "index": 18
        },
        {
          "code": "FWC-19",
          "index": 19
        }
      ]
    },
    {
      "id": "mex",
      "name": "México",
      "group": "Grupo A",
      "stickers": [
        {
          "code": "MEX-1",
          "index": 20,
          "special": true
        },
        {
          "code": "MEX-2",
          "index": 21
        },
        {
          "code": "MEX-3",
          "index": 22
        },
        {
          "code": "MEX-4",
          "index": 23
        },
        {
          "code": "MEX-5",
          "index": 24
        },
        {
          "code": "MEX-6",
          "index": 25
        },
        {
          "code": "MEX-7",
          "index": 26
        },
        {
          "code": "MEX-8",
          "index": 27
        },
        {
          "code": "MEX-9",
          "index": 28
        },
        {
          "code": "MEX-10",
          "index": 29
        },
        {
          "code": "MEX-11",
          "index": 30
        },
        {
          "code": "MEX-12",
          "index": 31
        },
        {
          "code": "MEX-13",
          "index": 32
        },
        {
          "code": "MEX-14",
          "index": 33
        },
        {
          "code": "MEX-15",
          "index": 34
        },
        {
          "code": "MEX-16",
          "index": 35
        },
        {
          "code": "MEX-17",
          "index": 36
        },
        {
          "code": "MEX-18",
          "index": 37
        },
        {
          "code": "MEX-19",
          "index": 38
        },
        {
          "code": "MEX-20",
          "index": 39
        }
      ]
    },
    {
      "id": "rsa",
      "name": "Sudáfrica",
      "group": "Grupo A",
      "stickers": [
        {
          "code": "RSA-1",
          "index": 40,
          "special": true
        },
        {
          "code": "RSA-2",
          "index": 41
        },
        {
          "code": "RSA-3",
          "index": 42
        },
        {
          "code": "RSA-4",
          "index": 43
        },
        {
          "code": "RSA-5",
          "index": 44
        },
        {
          "code": "RSA-6",
          "index": 45
        },
        {
          "code": "RSA-7",
          "index": 46
        },
        {
          "code": "RSA-8",
          "index": 47
        },
        {
          "code": "RSA-9",
          "index": 48
        },
        {
          "code": "RSA-10",
          "index": 49
        },
        {
          "code": "RSA-11",
          "index": 50
        },
        {
          "code": "RSA-12",
          "index": 51
        },
        {
          "code": "RSA-13",
          "index": 52
        },
        {
          "code": "RSA-14",
          "index": 53
        },
        {
          "code": "RSA-15",
          "index": 54
        },
        {
          "code": "RSA-16",
          "index": 55
        },
        {
          "code": "RSA-17",
          "index": 56
        },
        {
          "code": "RSA-18",
          "index": 57
        },
        {
          "code": "RSA-19",
          "index": 58
        },
        {
          "code": "RSA-20",
          "index": 59
        }
      ]
    },
    {
      "id": "kor",
      "name": "Corea del Sur",
      "group": "Grupo A",
      "stickers": [
        {
          "code": "KOR-1",
          "index": 60,
          "special": true
        },
        {
          "code": "KOR-2",
          "index": 61
        },
        {
          "code": "KOR-3",
          "index": 62
        },
        {
          "code": "KOR-4",
          "index": 63
        },
        {
          "code": "KOR-5",
          "index": 64
        },
        {
          "code": "KOR-6",
          "index": 65
        },
        {
          "code": "KOR-7",
          "index": 66
        },
        {
          "code": "KOR-8",
          "index": 67
        },
        {
          "code": "KOR-9",
          "index": 68
        },
        {
          "code": "KOR-10",
          "index": 69
        },
        {
          "code": "KOR-11",
          "index": 70
        },
        {
          "code": "KOR-12",
          "index": 71
        },
        {
          "code": "KOR-13",
          "index": 72
        },
        {
          "code": "KOR-14",
          "index": 73
        },
        {
          "code": "KOR-15",
          "index": 74
        },
        {
          "code": "KOR-16",
          "index": 75
        },
        {
          "code": "KOR-17",
          "index": 76
        },
        {
          "code": "KOR-18",
          "index": 77
        },
        {
          "code": "KOR-19",
          "index": 78
        },
        {
          "code": "KOR-20",
          "index": 79
        }
      ]
    },
    {
      "id": "cze",
      "name": "Chequia",
      "group": "Grupo A",
      "stickers": [
        {
          "code": "CZE-1",
          "index": 80,
          "special": true
        },
        {
          "code": "CZE-2",
          "index": 81
        },
        {
          "code": "CZE-3",
          "index": 82
        },
        {
          "code": "CZE-4",
          "index": 83
        },
        {
          "code": "CZE-5",
          "index": 84
        },
        {
          "code": "CZE-6",
          "index": 85
        },
        {
          "code": "CZE-7",
          "index": 86
        },
        {
          "code": "CZE-8",
          "index": 87
        },
        {
          "code": "CZE-9",
          "index": 88
        },
        {
          "code": "CZE-10",
          "index": 89
        },
        {
          "code": "CZE-11",
          "index": 90
        },
        {
          "code": "CZE-12",
          "index": 91
        },
        {
          "code": "CZE-13",
          "index": 92
        },
        {
          "code": "CZE-14",
          "index": 93
        },
        {
          "code": "CZE-15",
          "index": 94
        },
        {
          "code": "CZE-16",
          "index": 95
        },
        {
          "code": "CZE-17",
          "index": 96
        },
        {
          "code": "CZE-18",
          "index": 97
        },
        {
          "code": "CZE-19",
          "index": 98
        },
        {
          "code": "CZE-20",
          "index": 99
        }
      ]
    },
    {
      "id": "can",
      "name": "Canadá",
      "group": "Grupo B",
      "stickers": [
        {
          "code": "CAN-1",
          "index": 100,
          "special": true
        },
        {
          "code": "CAN-2",
          "index": 101
        },
        {
          "code": "CAN-3",
          "index": 102
        },
        {
          "code": "CAN-4",
          "index": 103
        },
        {
          "code": "CAN-5",
          "index": 104
        },
        {
          "code": "CAN-6",
          "index": 105
        },
        {
          "code": "CAN-7",
          "index": 106
        },
        {
          "code": "CAN-8",
          "index": 107
        },
        {
          "code": "CAN-9",
          "index": 108
        },
        {
          "code": "CAN-10",
          "index": 109
        },
        {
          "code": "CAN-11",
          "index": 110
        },
        {
          "code": "CAN-12",
          "index": 111
        },
        {
          "code": "CAN-13",
          "index": 112
        },
        {
          "code": "CAN-14",
          "index": 113
        },
        {
          "code": "CAN-15",
          "index": 114
        },
        {
          "code": "CAN-16",
          "index": 115
        },
        {
          "code": "CAN-17",
          "index": 116
        },
        {
          "code": "CAN-18",
          "index": 117
        },
        {
          "code": "CAN-19",
          "index": 118
        },
        {
          "code": "CAN-20",
          "index": 119
        }
      ]
    },
    {
      "id": "bih",
      "name": "Bosnia y Herzegovina",
      "group": "Grupo B",
      "stickers": [
        {
          "code": "BIH-1",
          "index": 120,
          "special": true
        },
        {
          "code": "BIH-2",
          "index": 121
        },
        {
          "code": "BIH-3",
          "index": 122
        },
        {
          "code": "BIH-4",
          "index": 123
        },
        {
          "code": "BIH-5",
          "index": 124
        },
        {
          "code": "BIH-6",
          "index": 125